[{"id":"dp-text-1-1-p01-s01","author":"seneca","authorNameDe":"Lucius Annaeus Seneca","authorNameKo":"루키우스 안나이우스 세네카","work":"dp","workTitleDe":"De providentia","workTitleKo":"섭리에 관하여","edition":"Moral Essays, vol. I (1928)","editor":"John William Basore","transcriptionStatus":"Perseus TEI 구조 검증 완료","volume":"","volumeTitleDe":"","volumeTitleKo":"","part":"Text","partTitleDe":"Ad Lucilium","partTitleKo":"루킬리우스에게","section":"1","sectionLabel":"제1장","sectionTitleDe":"","sectionTitleKo":"","paragraph":0,"paragraphCount":6,"sentence":0,"german":"Quaesisti a me, Lucili, quid ita, si providentia mundus regeretur, multa bonis viris mala acciderent. Hoc commodius in contextu operis redderetur, cum praeesse universis providentiam probaremus et interesse nobis deum; sed quoniam a toto particulam revelli placet et unam contradictionem manente lite integra solvere, faciam rem non difficilem, causam deorum agam.","korean":"루킬리우스여, 그대는 만일 섭리가 세계를 다스린다면 왜 선한 사람들에게 그토록 많은 악이 닥치는지를 내게 물었습니다. 이 문제는 섭리가 만물을 지배하며 신이 우리에게 관심을 둔다는 점을 논증하는 한 편의 완결된 저술 속에서 더 알맞게 답할 수 있을 것입니다. 그러나 그대가 전체에서 작은 부분 하나를 떼어 내어 본안의 논쟁은 그대로 둔 채 한 가지 반론만 해결하기를 원하니, 어렵지 않은 일을 맡아 신들을 변호하겠습니다.","translationStatus":"draft","footnotes":[{"label":"루킬리우스","text":"세네카의 《도덕 서한》과 여러 자연학 저술을 헌정받은 친구다. 이 대화편도 루킬리우스의 질문에 답하는 형식을 취한다."}],"sourceUrl":"https://atlas.perseus.tufts.edu/library/urn:cts:latinLit:stoa0255.stoa012/","sourceFile":"sources/raw/seneca/dp-perseus.xml","originalLanguage":"la","original":"Quaesisti a me, Lucili, quid ita, si providentia mundus regeretur, multa bonis viris mala acciderent. Hoc commodius in contextu operis redderetur, cum praeesse universis providentiam probaremus et interesse nobis deum; sed quoniam a toto particulam revelli placet et unam contradictionem manente lite integra solvere, faciam rem non difficilem, causam deorum agam.","authorNameOriginal":"Lucius Annaeus Seneca","workTitleOriginal":"De providentia","partTitleOriginal":"Ad Lucilium","sectionTitleOriginal":"","sourceSection":"1","sourceParagraph":0,"sourceSectionParagraphCount":1},{"id":"dp-text-1-2-p01-s01","author":"seneca","authorNameDe":"Lucius Annaeus Seneca","authorNameKo":"루키우스 안나이우스 세네카","work":"dp","workTitleDe":"De providentia","workTitleKo":"섭리에 관하여","edition":"Moral Essays, vol. I (1928)","editor":"John William Basore","transcriptionStatus":"Perseus TEI 구조 검증 완료","volume":"","volumeTitleDe":"","volumeTitleKo":"","part":"Text","partTitleDe":"Ad Lucilium","partTitleKo":"루킬리우스에게","section":"1","sectionLabel":"제1장","sectionTitleDe":"","sectionTitleKo":"","paragraph":1,"paragraphCount":6,"sentence":0,"german":"Supervacuum est in praesentia ostendere non sine aliquo custode tantum opus stare nec hunc siderum coetum discursumque fortuiti impetus esse, et quae casus incitat saepe turbari et cito arietare, hanc inoffensam velocitatem procedere aeternae legis imperio tantum rerum terra marique gestantem, tantum clarissimorum luminum et ex disposito relucentium; non esse materiae errantis hunc ordinem nec quae temere coierunt tanta arte pendere, ut terrarum gravissimum pondus sedeat immotum et circa se properantis caeli fugam spectet, ut infusa vallibus maria molliant terras nec ullum incrementum fluminum sentiant, ut ex minimis seminibus nascantur ingentia.","korean":"지금은 이토록 거대한 작품인 우주가 어떤 수호자도 없이 서 있는 것이 아니며, 별들이 모이고 운행하는 일이 우연한 충동의 결과가 아님을 보여 줄 필요가 없습니다. 우연이 몰아붙이는 것은 자주 흐트러지고 곧 서로 충돌하지만, 이 막힘 없는 속도는 영원한 법칙의 명령에 따라 나아가며 땅과 바다에서 일어나는 그토록 많은 것들, 정해진 질서에 따라 빛나는 그토록 많은 찬란한 천체를 실어 나릅니다. 이런 질서는 방황하는 물질의 산물일 수 없고, 무작정 한데 모인 것들이 그토록 정교한 솜씨로 균형을 이룰 수도 없습니다. 가장 무거운 땅덩어리가 움직이지 않고 제자리에 앉아 자기 둘레로 질주하는 하늘의 비행을 바라보고, 골짜기에 흘러든 바다가 땅을 부드럽게 적시면서도 강물이 불어나 흘러들어도 조금도 늘어나지 않으며, 아주 작은 씨앗에서 거대한 것들이 태어나는 질서를 말입니다.","translationStatus":"draft","footnotes":[],"sourceUrl":"https://atlas.perseus.tufts.edu/library/urn:cts:latinLit:stoa0255.stoa012/","sourceFile":"sources/raw/seneca/dp-perseus.xml","originalLanguage":"la","original":"Supervacuum est in praesentia ostendere non sine aliquo custode tantum opus stare nec hunc siderum coetum discursumque fortuiti impetus esse, et quae casus incitat saepe turbari et cito arietare, hanc inoffensam velocitatem procedere aeternae legis imperio tantum rerum terra marique gestantem, tantum clarissimorum luminum et ex disposito relucentium; non esse materiae errantis hunc ordinem nec quae temere coierunt tanta arte pendere, ut terrarum gravissimum pondus sedeat immotum et circa se properantis caeli fugam spectet, ut infusa vallibus maria molliant terras nec ullum incrementum fluminum sentiant, ut ex minimis seminibus nascantur ingentia.","authorNameOriginal":"Lucius Annaeus Seneca","workTitleOriginal":"De providentia","partTitleOriginal":"Ad Lucilium","sectionTitleOriginal":"","sourceSection":"2","sourceParagraph":0,"sourceSectionParagraphCount":1},{"id":"dp-text-1-3-p01-s01","author":"seneca","authorNameDe":"Lucius Annaeus Seneca","authorNameKo":"루키우스 안나이우스 세네카","work":"dp","workTitleDe":"De providentia","workTitleKo":"섭리에 관하여","edition":"Moral Essays, vol. I (1928)","editor":"John William Basore","transcriptionStatus":"Perseus TEI 구조 검증 완료","volume":"","volumeTitleDe":"","volumeTitleKo":"","part":"Text","partTitleDe":"Ad Lucilium","partTitleKo":"루킬리우스에게","section":"1","sectionLabel":"제1장","sectionTitleDe":"","sectionTitleKo":"","paragraph":2,"paragraphCount":6,"sentence":0,"german":"Ne illa quidem quae videntur confusa et incerta, pluvias dico nubesque et elisorum fulminum iactus et incendia ruptis montium verticibus effusa, tremores labantis soli aliaque quae tumultuosa pars rerum circa terras movet, sine ratione, quamvis subita sint, accidunt, sed suas et illa causas habent non minus quam quae alienis locis conspecta miraculo sunt, ut in mediis fluctibus calentes aquae et nova insularum in vasto exsilientium mari spatia.","korean":"혼란스럽고 불확실해 보이는 것들, 곧 비와 구름, 부딪쳐 터진 벼락의 투척, 산꼭대기가 갈라져 쏟아지는 불, 흔들리는 땅의 진동과 그 밖에 지상 부근의 격동하는 자연이 일으키는 현상들조차 갑작스럽기는 해도 이성적 원인 없이 일어나지 않습니다. 한가운데 바다에서 솟는 뜨거운 물이나 망망대해에 갑자기 솟아나는 새 섬처럼, 제자리를 벗어난 곳에서 보여 경이롭게 여겨지는 현상들과 마찬가지로 저마다 원인을 지니고 있습니다.","translationStatus":"draft","footnotes":[],"sourceUrl":"https://atlas.perseus.tufts.edu/library/urn:cts:latinLit:stoa0255.stoa012/","sourceFile":"sources/raw/seneca/dp-perseus.xml","originalLanguage":"la","original":"Ne illa quidem quae videntur confusa et incerta, pluvias dico nubesque et elisorum fulminum iactus et incendia ruptis montium verticibus effusa, tremores labantis soli aliaque quae tumultuosa pars rerum circa terras movet, sine ratione, quamvis subita sint, accidunt, sed suas et illa causas habent non minus quam quae alienis locis conspecta miraculo sunt, ut in mediis fluctibus calentes aquae et nova insularum in vasto exsilientium mari spatia.","authorNameOriginal":"Lucius Annaeus Seneca","workTitleOriginal":"De providentia","partTitleOriginal":"Ad Lucilium","sectionTitleOriginal":"","sourceSection":"3","sourceParagraph":0,"sourceSectionParagraphCount":1},{"id":"dp-text-1-4-p01-s01","author":"seneca","authorNameDe":"Lucius Annaeus Seneca","authorNameKo":"루키우스 안나이우스 세네카","work":"dp","workTitleDe":"De providentia","workTitleKo":"섭리에 관하여","edition":"Moral Essays, vol. I (1928)","editor":"John William Basore","transcriptionStatus":"Perseus TEI 구조 검증 완료","volume":"","volumeTitleDe":"","volumeTitleKo":"","part":"Text","partTitleDe":"Ad Lucilium","partTitleKo":"루킬리우스에게","section":"1","sectionLabel":"제1장","sectionTitleDe":"","sectionTitleKo":"","paragraph":3,"paragraphCount":6,"sentence":0,"german":"Iam vero si quis observaverit nudari litora pelago in se recedente eademque intra exiguum tempus operiri, credet caeca quadam volutatione modo contrahi undas et introrsum agi, modo erumpere et magno cursu repetere sedem suam, cum interim illae portionibus crescunt et ad horam ac diem subeunt ampliores minoresque, prout illas lunare sidus elicuit, ad cuius arbitrium oceanus exundat. Suo ista tempori reserventur, eo quidem magis quod tu non dubitas de providentia sed querens.","korean":"더구나 바다가 안으로 물러나 해안이 드러났다가 짧은 시간이 지나 다시 덮이는 것을 지켜본 사람은, 파도가 어떤 맹목적인 뒤척임 때문에 때로 움츠러들어 안으로 밀려가고 때로 터져 나와 거대한 기세로 제자리로 돌아온다고 믿을 것입니다. 그러나 실제로 파도는 일정한 비율로 커지며, 달이 끌어당기는 정도에 따라 시각과 날짜에 맞추어 더 크게 또는 더 작게 밀려옵니다. 대양은 달의 명령에 따라 넘쳐흐릅니다. 이 문제들은 제때를 위해 남겨 둡시다. 그대는 섭리를 의심하는 것이 아니라 섭리에게 불평하고 있으니 더더욱 그렇습니다.","translationStatus":"draft","footnotes":[],"sourceUrl":"https://atlas.perseus.tufts.edu/library/urn:cts:latinLit:stoa0255.stoa012/","sourceFile":"sources/raw/seneca/dp-perseus.xml","originalLanguage":"la","original":"Iam vero si quis observaverit nudari litora pelago in se recedente eademque intra exiguum tempus operiri, credet caeca quadam volutatione modo contrahi undas et introrsum agi, modo erumpere et magno cursu repetere sedem suam, cum interim illae portionibus crescunt et ad horam ac diem subeunt ampliores minoresque, prout illas lunare sidus elicuit, ad cuius arbitrium oceanus exundat. Suo ista tempori reserventur, eo quidem magis quod tu non dubitas de providentia sed querens.","authorNameOriginal":"Lucius Annaeus Seneca","workTitleOriginal":"De providentia","partTitleOriginal":"Ad Lucilium","sectionTitleOriginal":"","sourceSection":"4","sourceParagraph":0,"sourceSectionParagraphCount":1},{"id":"dp-text-1-5-p01-s01","author":"seneca","authorNameDe":"Lucius Annaeus Seneca","authorNameKo":"루키우스 안나이우스 세네카","work":"dp","workTitleDe":"De providentia","workTitleKo":"섭리에 관하여","edition":"Moral Essays, vol. I (1928)","editor":"John William Basore","transcriptionStatus":"Perseus TEI 구조 검증 완료","volume":"","volumeTitleDe":"","volumeTitleKo":"","part":"Text","partTitleDe":"Ad Lucilium","partTitleKo":"루킬리우스에게","section":"1","sectionLabel":"제1장","sectionTitleDe":"","sectionTitleKo":"","paragraph":4,"paragraphCount":6,"sentence":0,"german":"In gratiam te reducam cum diis adversus optimos optimis. Neque enim rerum natura patitur ut umquam bona bonis noceant; inter bonos viros ac deos amicitia est conciliante virtute. Amicitiam dico? Immo etiam necessitudo et similitudo, quoniam quidem bonus tempore tantum a deo differt, discipulus eius ae